{
  "host": {
    "os": "Version 14.0 (Build 23A344)",
    "ips": [
      "192.168.11.151"
    ],
    "serial": "C02ZW0GTLVDL",
    "hostname": "LMAC-ZW0GTLVDL",
    "protectVersion": "5.0.0.1",
    "provisioningUDID": "32EC79C5-26DC-535A-85F7-986F063297E2"
  },
  "match": {
    "tags": [],
    "uuid": "816d8012-dec5-4569-bf7a-04df2594ac42",
    "event": {
      "uuid": "19e11623-95ce-436e-9158-2002c643bbc3",
      "blocked": true,
      "process": {
        "gid": 0,
        "pid": 39356,
        "uid": 0,
        "args": [
          "/Library/JMTTrader/CrashReporter",
          "Maintain"
        ],
        "name": "CrashReporter",
        "path": "/Library/JMTTrader/CrashReporter",
        "pgid": 39356,
        "ppid": 1,
        "rgid": 0,
        "ruid": 0,
        "uuid": "3a842375-29f4-4516-8c8e-aca148c3ab32",
        "signingInfo": {
          "appid": "",
          "status": -67068,
          "teamid": "",
          "signerType": 4,
          "authorities": [],
          "entitlements": [],
          "statusMessage": "cannot find code object on disk"
        },
        "startTimestamp": 1668430737,
        "originalParentPID": 1
      },
      "matchType": "Threat Signature",
      "timestamp": 1668430737.24338,
      "matchValue": "applejeus_jmt_a"
    },
    "facts": [
      {
        "name": "ThreatMatchExecEvent",
        "tags": [
          "ThreatMatchExecEvent"
        ],
        "uuid": "3b434ba4-fd28-4c11-aeb9-ce571e81f712",
        "human": "A process has been denied execution.",
        "actions": [
          {
            "name": "DisplayMessage",
            "parameters": {
              "title": "CrashReporter Has Been Blocked.",
              "message": "This software has been identified as a malicious or potentially unwanted program. It has been blocked, moved to quarantine, and reported to your IT Administrator or Security Team."
            }
          },
          {
            "name": "Report",
            "parameters": {}
          },
          {
            "name": "Prevented",
            "parameters": {}
          }
        ],
        "context": [],
        "version": 11568,
        "severity": 3
      }
    ],
    "custom": false,
    "actions": [
      {
        "name": "DisplayMessage",
        "parameters": {
          "title": "CrashReporter Has Been Blocked.",
          "message": "This software has been identified as a malicious or potentially unwanted program. It has been blocked, moved to quarantine, and reported to your IT Administrator or Security Team."
        }
      },
      {
        "name": "Report",
        "parameters": {}
      },
      {
        "name": "Prevented",
        "parameters": {}
      }
    ],
    "context": [],
    "severity": 3
  },
  "related": {
    "files": [],
    "users": [
      {
        "uid": 0,
        "name": "root",
        "uuid": "C02ZW0GTLVDL0"
      }
    ],
    "groups": [
      {
        "gid": 0,
        "name": "wheel",
        "uuid": "C02ZW0GTLVDL0"
      }
    ],
    "binaries": [],
    "processes": [
      {
        "gid": 0,
        "pid": 39356,
        "uid": 0,
        "args": [
          "/Library/JMTTrader/CrashReporter",
          "Maintain"
        ],
        "name": "CrashReporter",
        "path": "/Library/JMTTrader/CrashReporter",
        "pgid": 39356,
        "ppid": 1,
        "rgid": 0,
        "ruid": 0,
        "uuid": "3a842375-29f4-4516-8c8e-aca148c3ab32",
        "signingInfo": {
          "appid": "",
          "status": -67068,
          "teamid": "",
          "signerType": 4,
          "authorities": [],
          "entitlements": [],
          "statusMessage": "cannot find code object on disk"
        },
        "startTimestamp": 1668430737,
        "originalParentPID": 1
      }
    ]
  },
  "eventType": "GPThreatMatchExecEvent"
}